Esperando vc falar "quero assistir um pipocao so explosao , porrada e testosterona" pra levar velozes e furiosos	Positivo
Qdo eu era adolescente e ficava bebada, ninguem passava a mao na minha cabeca. Por que ele tem defensores ? Ninguem o obrigou a beber/cheirar	Negativo
Expectativa de adolescente para a universidade: dormir tarde pq vai ser American Pie . Realidade: ir dormir tarde fazendo relatorio.	Negativo
Da nem pra assistir homem aranha em paz pqp	Negativo
O filme da mulher maravilha e doido demais nuu	Positivo
no American Pie tem os Stifler , na vida real tem a familia Lugon to rindo tanto	Neutro
os mesmos q inocentaram vaccari? q passaram por cima do Moro?sao os mesmos mercenarios q vao julgar o lularapio?o perigo ta ai	Negativo
Perigo nada, velozes e furiosos aqui	Neutro
To vendo invocacao do mal 2 .. o mnr .e lembra o banana kkkkk	Neutro
Sera que tem perigo da minha avo morrer do coracao assistindo invocacao do mal 2 comigo?	Neutro
Em nenhum momento consegui sentir tensao, como se ele corresse perigo . Homem aranha que parece um mini Iron man. Essa formula encheu o saco	Negativo
Homem aranha , q filmao	Positivo
O homem-aranha tem o sentido aranha pra avisar ele do perigo q ele nao ta vendo e eu tenho o sentido de fazer merda...	Negativo
Acho que ronda sim um senso de perigo no filme, desde a 1 cena em o homem aranha e pego de surpresa pelo abutre	Positivo
Eu achei esse novo filme do homem aranha uma merda. primeiro que: o abutre nao era perigo nenhum, diferente do Lagarto, electro, venom, etc	Negativo
meu sonho e estar em perigo e o homem aranha vir me salvar	Neutro
Estranho mesmo e o fato do sentido aranha agora se chamar sentido purpurina: " no perigo , o homem aranha comeca a dancar I WILL SURVIVE.	Neutro
eu namoro com a mulher maravilha e nem sabia, nunca vou correr perigo kkkkkkkkkkkkkkkkkkkkkkkkkk	Neutro
a mulher maravilha somos todas nos mulheres que enfrentamos o perigo sem medo e seguindo o nosso caminho com o amor	Positivo
Que perigo !!! Paulo depois dessa exposicao pode ser facilmente violentado pelos defensores do almofadinha 	Neutro
Brasil, pais mais perigoso para defensores do meio ambiente	Negativo
O River Plate chega com perigo , cruzamento na area, Alario desvia e Scocco nao alcanca, placar segue zerado no Defensores del Chaco!	Neutro
Ja vi velozes e furiosos 7 umas mil vezes, mas nao me conformo nunca pq nao aparece a corrida do Toretto e o ouro carinha la em tokio	Negativo
velozes e furiosos : corrida de velocipedes 	Neutro
e o que eu acho. E outra: e aquela corrida de carros/motos no meio do trailer? KKKKKK muito velozes e furiosos sim!	Neutro
BATTLEGROUNDS - Top Gear e Velozes e Furiosos 	Neutro
"Diretor de Velozes e Furiosos 8 diz q existe a possibilidade da franquia ir pro espaco" eles iriam postar corrida d um planeta p outro? rs	Neutro
N amor , vc anda apostando a corrida velozes e furiosos	Neutro
Um filme sobre corrida e vinganca. Gracas a Deus Need for Speed existe pra preencher o vazio do Velozes e Furiosos	Positivo
RT  Meu Malvado Favorito 3 e Homem Aranha: De Volta ao Lar continuam em cartaz. O simpatico carro de corrida , o lendario Relampago McQu...	Neutro
@srpedro faz FLASH x HOMEM ARANHA no corrida PvP por favor	Neutro
Go h3lio goooooooo da-lhe gas com forca go Castroneves goooooooo vamos la Homem Aranha goooooo e muita sorte para esta corrida	Neutro
RT Meu Malvado Favorito 3 e  Homem Aranha : De Volta ao Lar continuam em cartaz. O simpatico carro de corrida , o lendario Relampago McQu...	Neutro
Dai a gente descobre q na verdade a corrida era uma acao promocional do novo filme do Homem Aranha	Neutro
to me sentindo a mulher maravilha depois de ter feito uma corrida de 8km. eu fico mto feliz em por meu corpo a prova de coisas q eu achava	Positivo
Eu queria muito a inscricao da Corrida da Mulher Maravilha . Mas, por achar que estava muito longe a data da corrida eu deixei pra la	Negativo
aquela atriz de mulher maravilha que tambem e uma cachorra de corrida em cancha reta a galga dot	Negativo
Vi um bgl de caminhada/ corrida c tema da mulher maravilha , queria MT ir mas ja esgotou os kits poxxxxxa	Negativo
Procuro amizades fitness para participar da corrida da mulher maravilha	Neutro
LC cagaram com aquele Kid Cascavel IF acho que eles fizeram ela corrida pra lancar Defensores logo Punisher tem tudo pra ser a melhor deles	Negativo
desanima, eu nao me conformo com esse gol, tudo errado, a corrida do noguera, k Vanderlei, os defensores no rebote TUDO ERRADO	Negativo
Baywatch versao casa da Bia! Ja estou a treinar a corrida em camara lenta, melhor que a CJ	Positivo
O American pie da corrida e mais dhr	Positivo
tem que ter paciencia pra gostar velozes e furiosos mds	Negativo
planejo de passar o dia vendo a maratona de velozes e furiosos que e meu filme fav, dai do nada perco a paciencia ate de assistir	Positivo
Eu O D E I O Velozes e furiosos e Caio faz questao de assistir, paciencia	Negativo
Eu estava assistindo Moana que tava louca p ver, porem tava travando e n tenho paciencia , to vendo velozes e furiosos 8, de novo	Negativo
Coisas que o mundo nao para de fazer: Torrar minha paciencia Filme dos Transformers Filme dos Velozes e Furiosos Treta Especial do Roberto	Negativo
ai olha eu to mt sem paciencia	Negativo
na moral eu qria mt ter mais paciencia pra certas coisas MAS EU NAO TENHO	Negativo
eu tenho q ter uma paciencia do caralho com certas pessoas daquele curso pq senao eu mando tomar no cu bonitinho PQ EU NAO TENHO PACIENCIA	Negativo
ai pelo amor de @deus ne alguem me da paciencia por favor	Negativo
eu nao to com a menor paciencia pra discutir com gente homofobica disfarcando preconceito com "minha opiniao"	Negativo
- Qual o problema de nao ir para o ceu? - "Eu nao sou um homem do ceu" Invocacao do Mal 3	Positivo
Minha paciencia sumiu igual o fandom do Crepusculo	Negativo
O meu primeiro e ultimo youtuber foi o Nelipe na epoca do Crepusculo . So. Nao tenho paciencia .	Negativo
To vendo Fallen, ja pausei varias vezes, sem paciencia pra essa copia mal feita de crepusculo .<SEP>2017-06-25	Negativo
Eu ia assistir mas nao tenho paciencia e troquei por meu malvado favorito ! Recomendo	Neutro
Meu Malvado Favorito 3 e bom SIM quem gostou bate palma quem nao gostou paciencia	Positivo
Tres filmes para assistir no cinema. So tenho paciencia pra ir ver um. Homem aranha x Mulher Maravilha x Meu malvado favorito 3?	Neutro
Estava pensando em levar ela pra assistir Meu Malvado Favorito 3, mas desse jeito nao da. Nao tenho paciencia nao	Neutro
Passando pra agradecer por terem paciencia de irem comigo assistir Meu Malvado Favorito 3 @_JullyanaL @Roccodiogo_	Positivo
Eu nao tenho um pingo de paciencia pra ver desenhos, mas que eu vou assistir meu malvado favorito 3 eu vou. Como eu gosto desse rs	Positivo
"Vc acha que ela teria paciencia pra alguem agarrada com ela?" "ate o meu malvado favorito se driblou, n e possivel que vc n vai tbm" -mae	Neutro
Queria ver Meu Malvado Favorito 3 hoje, mas n sei se meu filho vai ter paciencia pra assistir Cmg kk.	Negativo
Achei qualidades em mim. La no fundo, bem la no fundo. Aonde poucos tem paciencia de chegar, ou enxergar. - Querido john	Positivo
Mais amor ao falar. Mais paciencia ao ouvir.	Neutro
Os timidos sempre impressionam aqueles que tem paciencia de conhece-los melhor.	Positivo
Homem aranha e muito bom! Fora o ato comico do cara cortar os creditos e depois botar de novo com o Capitao America dizendo tenham paciencia	Positivo
Pra quem Ainda nao viu Homem-Aranha ... fique ate o final dos creditos!! TENHA PACIENCIA	Neutro
O espetacular homem aranha e um dos piores filmes da marvel SIM quem nao concorda com esse fato paciencia	Negativo
To sem paciencia pro meu pai. Me ajudem!	Negativo
Sobre a cena pos credito de homem aranha .... Paciencia e a chave	Neutro
#mulhermaravilha - Mais amor ao falar. Mais paciencia ao ouvir.	Neutro
So eu mesma pra ter essa paciencia em lembrar de todos	Negativo
Nao tenho paciencia pra gente que so vem atras quando convem	Negativo
Sem paciencia , evitando falar com as pessoas, sinto que estou incomodando todos	Negativo
N tou cm paciencia p elogios, isso n me serve de nada sinc, podia ser a mulher maravilha se n tiver bem n vou tar bem e acabou se	Negativo
0 paciencia p homem falando mal de mulher maravilha	Negativo
Tres filmes para assistir no cinema. So tenho paciencia pra ir ver um. Homem aranha x Mulher Maravilha x Meu malvado favorito 3?	Neutro
eu n tenho paciencia pros defensores de homeopatia	Negativo
Cade os defensores do Fred e companhia dizendo que temos que ter paciencia . Esta paciencia nao mudou a historia	Negativo
Dai-me paciencia pra defensores de Ze Ricardo kkkkkkkkk	Negativo
Pessoa testa a paciencia da gente ate o limite. E olha q/ meu limite e longo. Agora sera tolerancia zero p/ defensores de FDP c/o o prefeito	Negativo
